{
  "claims": [
    {
      "claim": "Offline fixture evidence for Offline Fixture Corrective Retrieval Study 07",
      "claim_id": "offline-claim-001",
      "claim_type": "paper_result",
      "evidence_location": "offline fixture abstract excerpt",
      "evidence_type": "abstract",
      "extraction_uncertainty": "Offline mock; not a live paper analysis.",
      "identifiers": {
        "doi": "10.5555/offline.07",
        "semantic_scholar_paper_id": "0000000000000000000000000000000000000007"
      },
      "paper_record_id": "paper-fb76496e560e",
      "paper_title": "Offline Fixture Corrective Retrieval Study 07",
      "paraphrase": "Synthetic fixture claim used only to exercise the offline pipeline.",
      "quote": null,
      "source_url": "https://www.semanticscholar.org/paper/0000000000000000000000000000000000000007",
      "verified": true
    },
    {
      "claim": "Offline fixture evidence for Offline Fixture Cross Encoder Reranker Study 05",
      "claim_id": "offline-claim-002",
      "claim_type": "paper_result",
      "evidence_location": "offline fixture abstract excerpt",
      "evidence_type": "abstract",
      "extraction_uncertainty": "Offline mock; not a live paper analysis.",
      "identifiers": {
        "doi": "10.5555/offline.05",
        "semantic_scholar_paper_id": "0000000000000000000000000000000000000005"
      },
      "paper_record_id": "paper-95dc9b4808a5",
      "paper_title": "Offline Fixture Cross Encoder Reranker Study 05",
      "paraphrase": "Synthetic fixture claim used only to exercise the offline pipeline.",
      "quote": null,
      "source_url": "https://www.semanticscholar.org/paper/0000000000000000000000000000000000000005",
      "verified": true
    },
    {
      "claim": "Offline fixture evidence for Offline Fixture Self RAG Study 09",
      "claim_id": "offline-claim-003",
      "claim_type": "paper_result",
      "evidence_location": "offline fixture abstract excerpt",
      "evidence_type": "abstract",
      "extraction_uncertainty": "Offline mock; not a live paper analysis.",
      "identifiers": {
        "doi": "10.5555/offline.09",
        "semantic_scholar_paper_id": "0000000000000000000000000000000000000009"
      },
      "paper_record_id": "paper-9230a0fd10a1",
      "paper_title": "Offline Fixture Self RAG Study 09",
      "paraphrase": "Synthetic fixture claim used only to exercise the offline pipeline.",
      "quote": null,
      "source_url": "https://www.semanticscholar.org/paper/0000000000000000000000000000000000000009",
      "verified": true
    },
    {
      "claim": "Offline fixture evidence for Offline Fixture Adaptive Retrieval Study 11",
      "claim_id": "offline-claim-004",
      "claim_type": "paper_result",
      "evidence_location": "offline fixture abstract excerpt",
      "evidence_type": "abstract",
      "extraction_uncertainty": "Offline mock; not a live paper analysis.",
      "identifiers": {
        "doi": "10.5555/offline.11",
        "semantic_scholar_paper_id": "000000000000000000000000000000000000000b"
      },
      "paper_record_id": "paper-38335c98de76",
      "paper_title": "Offline Fixture Adaptive Retrieval Study 11",
      "paraphrase": "Synthetic fixture claim used only to exercise the offline pipeline.",
      "quote": null,
      "source_url": "https://www.semanticscholar.org/paper/000000000000000000000000000000000000000b",
      "verified": true
    },
    {
      "claim": "Offline fixture evidence for Offline Fixture Self Reflective Retrieval Study 10",
      "claim_id": "offline-claim-005",
      "claim_type": "paper_result",
      "evidence_location": "offline fixture abstract excerpt",
      "evidence_type": "abstract",
      "extraction_uncertainty": "Offline mock; not a live paper analysis.",
      "identifiers": {
        "doi": "10.5555/offline.10",
        "semantic_scholar_paper_id": "000000000000000000000000000000000000000a"
      },
      "paper_record_id": "paper-bf86d674eb1d",
      "paper_title": "Offline Fixture Self Reflective Retrieval Study 10",
      "paraphrase": "Synthetic fixture claim used only to exercise the offline pipeline.",
      "quote": null,
      "source_url": "https://www.semanticscholar.org/paper/000000000000000000000000000000000000000a",
      "verified": true
    },
    {
      "claim": "Offline fixture evidence for Offline Fixture Passage Reranking Study 06",
      "claim_id": "offline-claim-006",
      "claim_type": "paper_result",
      "evidence_location": "offline fixture abstract excerpt",
      "evidence_type": "abstract",
      "extraction_uncertainty": "Offline mock; not a live paper analysis.",
      "identifiers": {
        "doi": "10.5555/offline.06",
        "semantic_scholar_paper_id": "0000000000000000000000000000000000000006"
      },
      "paper_record_id": "paper-c3d5a3eb663e",
      "paper_title": "Offline Fixture Passage Reranking Study 06",
      "paraphrase": "Synthetic fixture claim used only to exercise the offline pipeline.",
      "quote": null,
      "source_url": "https://www.semanticscholar.org/paper/0000000000000000000000000000000000000006",
      "verified": true
    },
    {
      "claim": "Offline fixture evidence for Offline Fixture Query Reformulation Study 02",
      "claim_id": "offline-claim-007",
      "claim_type": "paper_result",
      "evidence_location": "offline fixture abstract excerpt",
      "evidence_type": "abstract",
      "extraction_uncertainty": "Offline mock; not a live paper analysis.",
      "identifiers": {
        "doi": "10.5555/offline.02",
        "semantic_scholar_paper_id": "0000000000000000000000000000000000000002"
      },
      "paper_record_id": "paper-fee62d4676d5",
      "paper_title": "Offline Fixture Query Reformulation Study 02",
      "paraphrase": "Synthetic fixture claim used only to exercise the offline pipeline.",
      "quote": null,
      "source_url": "https://www.semanticscholar.org/paper/0000000000000000000000000000000000000002",
      "verified": true
    },
    {
      "claim": "Offline fixture evidence for Offline Fixture Reranking Study 04",
      "claim_id": "offline-claim-008",
      "claim_type": "paper_result",
      "evidence_location": "offline fixture abstract excerpt",
      "evidence_type": "abstract",
      "extraction_uncertainty": "Offline mock; not a live paper analysis.",
      "identifiers": {
        "doi": "10.5555/offline.04",
        "semantic_scholar_paper_id": "0000000000000000000000000000000000000004"
      },
      "paper_record_id": "paper-399637e520c5",
      "paper_title": "Offline Fixture Reranking Study 04",
      "paraphrase": "Synthetic fixture claim used only to exercise the offline pipeline.",
      "quote": null,
      "source_url": "https://www.semanticscholar.org/paper/0000000000000000000000000000000000000004",
      "verified": true
    },
    {
      "claim": "Offline fixture evidence for Offline Fixture Faithful Retrieval Pipeline Study 12",
      "claim_id": "offline-claim-009",
      "claim_type": "paper_result",
      "evidence_location": "offline fixture abstract excerpt",
      "evidence_type": "abstract",
      "extraction_uncertainty": "Offline mock; not a live paper analysis.",
      "identifiers": {
        "doi": "10.5555/offline.12",
        "semantic_scholar_paper_id": "000000000000000000000000000000000000000c"
      },
      "paper_record_id": "paper-cda99a74fe44",
      "paper_title": "Offline Fixture Faithful Retrieval Pipeline Study 12",
      "paraphrase": "Synthetic fixture claim used only to exercise the offline pipeline.",
      "quote": null,
      "source_url": "https://www.semanticscholar.org/paper/000000000000000000000000000000000000000c",
      "verified": true
    },
    {
      "claim": "Offline fixture evidence for Offline Fixture Retrieval Correction Study 08",
      "claim_id": "offline-claim-010",
      "claim_type": "paper_result",
      "evidence_location": "offline fixture abstract excerpt",
      "evidence_type": "abstract",
      "extraction_uncertainty": "Offline mock; not a live paper analysis.",
      "identifiers": {
        "doi": "10.5555/offline.08",
        "semantic_scholar_paper_id": "0000000000000000000000000000000000000008"
      },
      "paper_record_id": "paper-cdc0d6a5f8d7",
      "paper_title": "Offline Fixture Retrieval Correction Study 08",
      "paraphrase": "Synthetic fixture claim used only to exercise the offline pipeline.",
      "quote": null,
      "source_url": "https://www.semanticscholar.org/paper/0000000000000000000000000000000000000008",
      "verified": true
    },
    {
      "claim": "Offline fixture evidence for Offline Fixture Query Rewriting Study 01",
      "claim_id": "offline-claim-011",
      "claim_type": "paper_result",
      "evidence_location": "offline fixture abstract excerpt",
      "evidence_type": "abstract",
      "extraction_uncertainty": "Offline mock; not a live paper analysis.",
      "identifiers": {
        "doi": "10.5555/offline.01",
        "semantic_scholar_paper_id": "0000000000000000000000000000000000000001"
      },
      "paper_record_id": "paper-67a7bccd81d1",
      "paper_title": "Offline Fixture Query Rewriting Study 01",
      "paraphrase": "Synthetic fixture claim used only to exercise the offline pipeline.",
      "quote": null,
      "source_url": "https://www.semanticscholar.org/paper/0000000000000000000000000000000000000001",
      "verified": true
    },
    {
      "claim": "Offline fixture evidence for Offline Fixture Multi Query Retrieval Study 03",
      "claim_id": "offline-claim-012",
      "claim_type": "paper_result",
      "evidence_location": "offline fixture abstract excerpt",
      "evidence_type": "abstract",
      "extraction_uncertainty": "Offline mock; not a live paper analysis.",
      "identifiers": {
        "doi": "10.5555/offline.03",
        "semantic_scholar_paper_id": "0000000000000000000000000000000000000003"
      },
      "paper_record_id": "paper-32d3496c835f",